,title,description,publishedAt,channelId,videoId,channelTitle,liveBroadcastContent
337,Ben Harburg: A View of the U.S.-China Trade War from Beijing,Recent challenges in the U.S.-China economic relationship have been well-documented in the United States and debated from every point of view. But how is ...,2019-03-14T15:36:08Z,UC1E5-wg_F4vFWWsP-CTcP1g,q3_nM6laTE4,National Committee on U.S.-China Relations,none
338,The U.S - China Trade War: 2020 Update! [HSC Economics Review Episode #17],"In Episode #17 of the HSC Economic Review segment, Terry and Rowan are going to discuss recent developments in regards to the U.S.A - China trade war ...",2020-06-10T06:18:16Z,UCrZDmupZ99dfVJfVMkFukHA,2gWW9CB8ynU,ArtofSmartTV,none
339,Monetary policy and the U.S–China trade war,"Yahoo Finance's Adam Shapiro, Pras Subramanian and Julie Hyman discuss monetary policy, interest rate and investing in gold with Lori Heinel of State Street ...",2019-09-06T19:17:06Z,UCEAZeUIeJs0IjQiqTCdVSIg,yCi5UFDUd08,Yahoo Finance,none
340,Cramer on US-China trade war: Is that all China can bring?,China will raise tariffs on $60 billion in U.S. goods in retaliation for the Trump administration's latest decision to increase duties on Chinese products. CNBC's ...,2019-05-13T14:11:48Z,UCrp_UI8XtuYfpiqluWLD7Lw,579PbrByy_U,CNBC Television,none
341,"Morgan Stanley On U.S.- China Trade War, Indian Rupee &amp; More","India can get quite lucky when the China-U.S. Trade war tensions are putting question marks over capital flows between the U.S. and China, says says Morgan ...",2019-06-12T03:45:27Z,UC3uJIdRFTGgLWrUziaHbzrg,SCI5fzjMBhI,BloombergQuint,none
342,The Big Story: US-China trade war’s impact on the rest of the world | The Straits Times (14/05/19),East Asia editor Goh Sui Noi talks about how the United States-China trade affects the rest of the world. Subscribe to The Straits Times YouTube channel for free: ...,2019-05-14T11:17:06Z,UC4p_I9eiRewn2KoU-nawrDg,W8sxElmIG1U,The Straits Times,none
343,US-China Trade War may impact Indian share market,"This segment of Zee Business brings to you latest information on sensex, nifty and other shares movement in the share market today. Also know US-China Trade ...",2018-04-03T13:45:17Z,UCkXopQ3ubd-rnXnStZqCl2w,AkYiCfxMcoY,Zee Business,none
344,U.S. -China Trade War and India - Audio Article,For VIDEO updates follow us at ------- ▻ फेसबुक : https://www.facebook.com/DrishtiMediavideos ▻ ट्विटर : https://twitter.com/DrishtiVideos ...,2019-06-10T12:11:35Z,UCzLqOSZPtUKrmSEnlH4LAvw,HQMwbBeCxmw,Drishti IAS,none
345,Global Market In The Green Beside US-China Trade War Tension | CNBC-TV18,"Indian equity indices, the BSE Sensex and the NSE Nifty50, ended sharply lower on Tuesday after a day of volatile trade. Indices fell sharply after the rupee ...",2018-09-18T17:06:58Z,UCmRbHAgG2k2vDUvb3xsEunQ,dFJqTyDkMLw,CNBC-TV18,none
346,How U.S.-China trade war is pinching profits for Maine&#39;s lobster industry,"Trade tensions between the U.S. and China are not expected to ease anytime soon, and in New England, tariffs are clawing away at lobster profits. Lobstering is ...",2019-09-13T00:49:17Z,UC6ZFN9Tx6xh-skXCuRHCDpQ,yjdc6hcJCC0,PBS NewsHour,none
347,US-China trade war: Chinese markets end week in red after Huawei ban,Chinese markets have ended the week in the red - still reeling after Washington blacklisted Chinese tech giant Huawei. Both the Shanghai composite and ...,2019-05-17T14:18:33Z,UC83jt4dlz1Gjl58fzQrrKZg,Xb9ggAScouU,CNA,none
348,"How the US-China trade war is affecting M&amp;A, IPOs and private equity",Yahoo Finance's Julie Hyman and Arel Rende of Clearsight Advisors discuss the impact of the trade war with David Austin Professor of Management at MIT ...,2019-08-30T18:47:25Z,UCEAZeUIeJs0IjQiqTCdVSIg,gtb1b8lm2-U,Yahoo Finance,none
349,"US-China trade war is causing hiring freezes, slowing investment in growth: Society Nine CEO","Lynn Le, Society Nine founder and CEO, joins 'The Exchange' to discuss how the tariff delay is impacting her business.",2019-08-16T19:13:32Z,UCrp_UI8XtuYfpiqluWLD7Lw,OjulLVlGmMw,CNBC Television,none
350,What is US China Trade WAR?,US & China are in the middle of a trade war. What does this mean to an Indian investor?,2019-08-26T11:32:07Z,UC7fQFl37yAOaPaoxQm-TqSA,Ug_ZKyTVwuw,Money Pechu,none
351,"Jim Cramer on Qualcomm, U.S.-China Trade War and What to Expect From Disney","Jim Cramer weighs in on Real Money Stock of the Day Qualcomm's QCOM earnings, Disney DIS and the U.S.-China trade war. Qualcomm Is Real Money's ...",2019-11-07T15:56:43Z,UCp6aBHRM6ZS_kLeC57HV4kg,C-SdizTUUrY,TheStreet: Investing Strategies,none
352,It&#39;s &#39;fantasy&#39; to expect China to kneel down to the US: Expert | East Tech West,"Victor Gao of the Center for China and Globalization says the U.S.-China trade war is the ""wrong war to fight"" and neither side will be able to win. He was ...",2019-11-20T09:00:01Z,UCF8HUTbUwPKh2Q-KpGOCVGw,ATSW1pwmyAU,CNBC International TV,none
353,Intel CEO Says Company Has Adapted to U.S.-China Trade War,Feb.18 -- Intel Chief Executive Officer Bob Swan talks about the impact of the U.S. trade war with China on his business. He speaks to Bloomberg's Brad Stone ...,2020-02-18T20:37:04Z,UCrM7B7SL_g1edFOnmj-SDKg,-VDV9WQyYzQ,Bloomberg Technology,none
354,US-China Trade War is Good News for Some Countries,"The continuing trade war between the U.S. and China may be causing businesses in both countries anxiety, but the trade dispute is good news for businesses in ...",2019-08-23T08:17:07Z,UCVSNOxehfALut52NbkfRBaA,3aZlg8ErpdU,VOA News,none
355,"China desperately needs a win in the trade war, strategist says","Sunaina Sinha Haldea, managing partner at Cebile Capital, discusses the U.S.-China trade war.",2019-12-02T09:00:05Z,UCF8HUTbUwPKh2Q-KpGOCVGw,OLCGBlymoF0,CNBC International TV,none
356,US-China trade war: Japanese suppliers of Huawei brace for drop in sales,"Like their counterparts in South Korea and Taiwan, Japanese suppliers of Huawei expect sales to drop if consumers around the world start shunning Huawei ...",2019-05-31T13:26:59Z,UC83jt4dlz1Gjl58fzQrrKZg,acpNZNEzht0,CNA,none
357,The U.S.-China trade war escalates. Will business confidence levels take a hit?,Visit our blog - http://blog.russellinvestments.com/?utm_medium=social&utm_source=youtube.com&utm_campaign=corp-120916--MWIR In the latest video ...,2019-05-10T20:08:48Z,UCIWPyCVlBnk7qpZ4BlbbopQ,LRYl1TOPM5U,Russell Investments,none
358,Explainer: The US-China trade war and its impact on consumers,"Subscribe to our YouTube channel for free here: https://sc.mp/subscribe-youtube China and the US are the world's two largest trading partners, and a trade war ...",2018-06-26T12:15:00Z,UC4SUWizzKc1tptprBkWjX2Q,hF0ueSiXcdI,South China Morning Post,none
359,🇵🇬 APEC summit dominated by US-China trade war | Al Jazeera English,"Trade tensions between the US and China have dominated the APEC meeting, which is wrapping up in Papua New Guinea's capital. On Saturday, Chinese ...",2018-11-18T07:24:54Z,UCNye-wNBqNL5ZzHSJj3l8Bg,73_BqNwg8Ow,Al Jazeera English,none
360,Tech still continues to face challenges from US-China trade war: Expert | Capital Connection,"Kiranjeet Kaur, senior research manager at IDC discusses tech sector's latest results.",2019-07-31T08:00:01Z,UCF8HUTbUwPKh2Q-KpGOCVGw,QjKElxgRWoo,CNBC International TV,none
361,US-China Trade War is Escalating QUICKLY! And I love it... (Here&#39;s Why),"Welcome to my world of stocks!!! My name is Ale, and today, we are talking about the US China trade war and how it is crashing the stock market, and why I ...",2019-08-24T12:00:00Z,UCXhrqxFZbG-k8l7v-XhX3ZQ,48BS62wL7YM,Ale's World of Stocks,none
362,National Economic Council Director Larry Kudlow weighs in on the escalated US-China trade war,Monday was the worst day of the year to date for the markets as the S&P saw a 3% fall and the Dow tumbled by more than 950 points at session lows.,2019-08-06T14:27:16Z,UCrp_UI8XtuYfpiqluWLD7Lw,fVOMkawcyjM,CNBC Television,none
363,Farmers begin to lose confidence in US-China trade war,"CNBC's Kayla Tausche reports from the Iowa State Fair, where Democratic presidential candidates are making their case against Trump as the U.S.-China trade ...",2019-08-09T15:54:05Z,UCrp_UI8XtuYfpiqluWLD7Lw,FmURrAvQw-w,CNBC Television,none
364,A look at the impact of the US-China trade war on consumers | Street Signs Europe,"Deborah Elms of the Asian Trade Centre says consumers are likely to pay more ""at some point"" due to the U.S.-China trade war.",2018-09-10T17:00:01Z,UCF8HUTbUwPKh2Q-KpGOCVGw,HoRrhgzvCe0,CNBC International TV,none
365,Valdis Dombrovskis - EU role in the US-China Trade War,"Valdis Dombrovskis - Vice-President for the Euro and Social Dialogue, also in charge of Financial Stability, Financial Services and Capital Markets Union of the ...",2018-04-09T10:03:08Z,UCqn5_o2qcIvKgtAexVqgGTw,1iKq5IkXV4o,ISPI,none
366,&#39;Dr.  Copper&#39; and the U.S.-China Trade War,"The base metal has long been known for its prophetic qualities when it comes to global economic trends. However, Dr. Copper has lately been focusing in on ...",2019-08-12T14:11:04Z,UChirEOpgFCupRAk5etXqPaA,hw64l996em8,Bloomberg QuickTake News,none
367,"The National for May 13, 2019 — WestJet Sold, U.S.-China Trade War, Alex Trebek","Welcome to The National, the flagship nightly newscast of CBC News »»» Subscribe to The National to watch more videos here: ...",2019-05-14T14:19:36Z,UCKjU3KzdbJE1EFcHVqXC3_g,YkdpPjfhYwA,CBC News: The National,none
368,Explainer: The US-China trade war and its impact on consumers,"Subscribe to our YouTube channel for free here: https://sc.mp/subscribe-youtube China and the US are the world's two largest trading partners, and a trade war ...",2018-06-26T12:15:00Z,UC4SUWizzKc1tptprBkWjX2Q,hF0ueSiXcdI,South China Morning Post,none
369,"Jim Cramer on Qualcomm, U.S.-China Trade War and What to Expect From Disney","Jim Cramer weighs in on Real Money Stock of the Day Qualcomm's QCOM earnings, Disney DIS and the U.S.-China trade war. Qualcomm Is Real Money's ...",2019-11-07T15:56:43Z,UCp6aBHRM6ZS_kLeC57HV4kg,C-SdizTUUrY,TheStreet: Investing Strategies,none
370,US-China trade war: New wave of tariffs take effect,"Tensions between China and the United States keep escalating, as a new round of tariffs on both countries' exports will come into effect in a few hours. China ...",2019-09-01T05:44:25Z,UCNye-wNBqNL5ZzHSJj3l8Bg,kPcWqzRPHuQ,Al Jazeera English,none
371,US-China trade war: Japanese suppliers of Huawei brace for drop in sales,"Like their counterparts in South Korea and Taiwan, Japanese suppliers of Huawei expect sales to drop if consumers around the world start shunning Huawei ...",2019-05-31T13:26:59Z,UC83jt4dlz1Gjl58fzQrrKZg,acpNZNEzht0,CNA,none
372,🇵🇬 APEC summit dominated by US-China trade war | Al Jazeera English,"Trade tensions between the US and China have dominated the APEC meeting, which is wrapping up in Papua New Guinea's capital. On Saturday, Chinese ...",2018-11-18T07:24:54Z,UCNye-wNBqNL5ZzHSJj3l8Bg,73_BqNwg8Ow,Al Jazeera English,none
373,Tech still continues to face challenges from US-China trade war: Expert | Capital Connection,"Kiranjeet Kaur, senior research manager at IDC discusses tech sector's latest results.",2019-07-31T08:00:01Z,UCF8HUTbUwPKh2Q-KpGOCVGw,QjKElxgRWoo,CNBC International TV,none
374,Kissinger warns of armed conflict if US-China trade war is not resolved,"Former US secretary of state Henry Kissinger has warned that an armed conflict could break out between the US and China, if they fail to resolve their trade war.",2019-11-21T13:51:56Z,UC83jt4dlz1Gjl58fzQrrKZg,hwFawgsEhL8,CNA,none
375,The Heat: US-China trade war,"Delegations from Beijing and Washington are expected to hold trade talks in September, after speaking this week by phone. The Trump administration said the ...",2019-08-17T01:58:04Z,UCj7wKsOBhRD9Jy4yahkMRMw,4Wi-GRq6l9U,CGTN America,none
376,US-China Trade War is Escalating QUICKLY! And I love it... (Here&#39;s Why),"Welcome to my world of stocks!!! My name is Ale, and today, we are talking about the US China trade war and how it is crashing the stock market, and why I ...",2019-08-24T12:00:00Z,UCXhrqxFZbG-k8l7v-XhX3ZQ,48BS62wL7YM,Ale's World of Stocks,none
377,National Economic Council Director Larry Kudlow weighs in on the escalated US-China trade war,Monday was the worst day of the year to date for the markets as the S&P saw a 3% fall and the Dow tumbled by more than 950 points at session lows.,2019-08-06T14:27:16Z,UCrp_UI8XtuYfpiqluWLD7Lw,fVOMkawcyjM,CNBC Television,none
378,How Canada can benefit from the U.S.-China trade war,,2018-04-05T16:12:14Z,UCYuLCUHAoN1fs3pZi3WPRnA,pgJGk7Gmu7w,Financial Post,none
379,U.S. China trade war threatens Port of Los Angeles,Yahoo Finance's Jessica Smith reports on the significant impact on jobs and trade the U.S.-China trade war would have at the Port of L.A. which is the largest ...,2019-08-27T21:01:08Z,UCEAZeUIeJs0IjQiqTCdVSIg,YPpAfFoDins,Yahoo Finance,none
380,Hong Kong container trucker living with impact of US-China trade war,"Subscribe to our YouTube channel for free here: https://sc.mp/subscribe-youtube In recent years, nearly half the products China has exported to the US have ...",2019-03-05T01:30:02Z,UC4SUWizzKc1tptprBkWjX2Q,bBoehBTv8yQ,South China Morning Post,none
381,"US-China trade war is a fight for global dominance in tech and health care, says Cresset Capital CIO","Jack Ablin, Cresset Capital CIO, and Evan Brown, UBS Asset Management, join ""Power Lunch"" to discuss how markets are responding to the U.S.-China trade ...",2019-05-21T19:10:00Z,UCrp_UI8XtuYfpiqluWLD7Lw,y-ZwLClBxjU,CNBC Television,none
382,2018/08/31: US China trade war &amp; Qing Dynasty costume drama,Trump is angling for even more tariffs against China... what can China do to soften the blow? A Chinese costume drama has taken the country and Asia by ...,2018-09-01T07:45:00Z,UCgrNz-aDmcr2uuto8_DL2jg,9Zg2Ndr87A8,CGTN,none
383,US-China trade war opens up export opportunities for India,US-China trade war has opened up new opportunities for India. Centre to announce new schemes for exporters. Details by Times Now's Heena Gambhir.,2019-09-12T14:23:59Z,UC6RJ7-PaXg6TIH2BzZfTV7w,GjTIFuA9Tfg,TIMES NOW,none
384,US-China trade war impacting American ginseng farmers,The trade dispute between the U.S. and China has impacted a range of industries not least a large portion of U.S. farming. Among the commodities to be affected ...,2019-09-12T00:42:21Z,UCj7wKsOBhRD9Jy4yahkMRMw,Sw6q24aizRs,CGTN America,none
385,Kissinger warns of armed conflict if US-China trade war is not resolved,"Former US secretary of state Henry Kissinger has warned that an armed conflict could break out between the US and China, if they fail to resolve their trade war.",2019-11-21T13:51:56Z,UC83jt4dlz1Gjl58fzQrrKZg,hwFawgsEhL8,CNA,none
386,The US-China trade war threw firms into disarray: Economist | Street Signs Asia,"The U.S.-China trade war is a ""huge issue"" in terms of business confidence and could be a major threat to the global economy if it is not resolved, says Shane ...",2019-07-19T11:00:06Z,UCF8HUTbUwPKh2Q-KpGOCVGw,lwj8NUSEJfc,CNBC International TV,none
387,Trump Lies About His Trade War with China: A Closer Look,Seth takes a closer look at the president ratcheting up his trade war with China and lying about what it means for American companies and consumers.,2019-05-16T01:00:04Z,UCVTyTA7-g9nopHeHbeuvpRA,rG9-8wmtOUM,Late Night with Seth Meyers,none
388,The US-China trade war threw firms into disarray: Economist | Street Signs Asia,"The U.S.-China trade war is a ""huge issue"" in terms of business confidence and could be a major threat to the global economy if it is not resolved, says Shane ...",2019-07-19T11:00:06Z,UCF8HUTbUwPKh2Q-KpGOCVGw,lwj8NUSEJfc,CNBC International TV,none
389,Trump Lies About His Trade War with China: A Closer Look,Seth takes a closer look at the president ratcheting up his trade war with China and lying about what it means for American companies and consumers.,2019-05-16T01:00:04Z,UCVTyTA7-g9nopHeHbeuvpRA,rG9-8wmtOUM,Late Night with Seth Meyers,none
390,US-China Trade War: What Investors Need To Know!,The Trade War between the USA and China has been going on for a while now. In this video we're going to talk about the implications this trade war has on ...,2019-04-10T18:24:40Z,UCmHm0w-JJfC2Ll1Of_WObAQ,xbafMtCz1lM,Cooper Academy - Investing,none
391,The Heat: US-China trade war,"Delegations from Beijing and Washington are expected to hold trade talks in September, after speaking this week by phone. The Trump administration said the ...",2019-08-17T01:58:04Z,UCj7wKsOBhRD9Jy4yahkMRMw,4Wi-GRq6l9U,CGTN America,none
392,Oil prices registering risks of the US-China trade war: Yergin,"Dan Yergin, HIS Markit Vice chairman, and CNBC's Brian Sullivan join 'The Exchange' to discuss the fall of oil prices and what's driving it lower.",2019-08-06T18:15:20Z,UCrp_UI8XtuYfpiqluWLD7Lw,UHv5kD6UQjA,CNBC Television,none
393,US-China trade war: American companies assess risk to business,"As the US-China trade war continues to rumble on, there are increasing fears that the decade-long expansion of the US economy is coming to an end.",2019-11-04T15:04:46Z,UC83jt4dlz1Gjl58fzQrrKZg,NqhlUC4esjs,CNA,none
394,[Foreign Correspondents] Ep.108 - The U.S.-China trade war _ Full Episode,Tensions between the G2 shaking up South Korea and the world economy. The current address and outlook of the U.S.-China trade war 한국과 세계 경제를 뒤 ...,2018-10-15T23:00:04Z,UC-PHIZjV-oX8H7zD1cCN2NQ,l5SAJ0ib3mM,ARIRANG TV,none
395,The Heat: US-China Trade War escalates,"The United States hits China with a new list of an additional $200 billion on Chinese products to be hit with tariffs. To discuss the new tariffs, Afshin Molavi, ...",2018-07-11T00:12:19Z,UCj7wKsOBhRD9Jy4yahkMRMw,ZLZZaVgNUTY,CGTN America,none
396,US-China trade war: New wave of tariffs take effect,"Tensions between China and the United States keep escalating, as a new round of tariffs on both countries' exports will come into effect in a few hours. China ...",2019-09-01T05:44:25Z,UCNye-wNBqNL5ZzHSJj3l8Bg,kPcWqzRPHuQ,Al Jazeera English,none
397,Chinese government warns global tech companies amid escalating U.S.-China trade war,"中, 무역전쟁 속 삼성 등과 면담…중국 ""정상 활동"" 주장 With the trade war intensifying between Washington and Beijing,... the Chinese government has confirmed ...",2019-06-11T03:42:49Z,UCzznO4xSV8BKnUBPyswtCUw,3-ZNAswCqv0,ARIRANG NEWS,none
398,Booking Holdings CEO on US-China trade war and the state of the consumer,"Glenn Fogel, Booking Holdings CEO, sits down with CNBC's Seema Mody to discuss the headwinds the travel industry is facing. They discuss consumer ...",2019-09-18T18:08:19Z,UCrp_UI8XtuYfpiqluWLD7Lw,NtCthAWE3ws,CNBC Television,none
399,"US-China trade war: Trade talks set to kick off amid threats, accusations",High stakes trade talks are set to kick off in Washington. But negotiations are poised on the brink of collapse after a week of threats and accusations. Subscribe ...,2019-05-09T14:00:46Z,UC83jt4dlz1Gjl58fzQrrKZg,ixrX5isXEVo,CNA,none
400,"Technology most vulnerable sector in US-China trade war, strategist says | Squawk Box Europe","Seema Shah, global investment strategist at Principal Global Investors, says if international trade controls impact the technology sector it could be damaging for ...",2019-05-17T10:00:08Z,UCF8HUTbUwPKh2Q-KpGOCVGw,dSSdAI2uTek,CNBC International TV,none
401,Trump escalates the US-China trade war by announcing tariff hikes,"Trump escalates the US-China trade war by announcing tariff hikes #92NewsHD Live, Pakistan's first HD Plus news channel brings you the crispiest live news, ...",2019-08-23T23:26:30Z,UCsgC5cbz3DE2Shh34gNKiog,B7AT76mukHY,92 News HD,none
402,🇺🇸 🇨🇳 Could the US China trade talks collapse | Inside Story,A rift has opened up between the world's two biggest economies just as attempts to end the US-China trade dispute appear to be making progress. The US says ...,2019-05-09T17:30:01Z,UCNye-wNBqNL5ZzHSJj3l8Bg,jOVlwKprB6o,Al Jazeera English,none
403,US-CHINA TRADE WAR - TAMIL,"US-CHINA TRADE WAR - TAMIL The Trump administration on Friday escalated a trade war between the world's two largest economies, moving ahead with ...",2018-06-18T11:05:55Z,UCcgBNWuHaU4n2OtpppAdQZA,wHOfrQuBmX8,Chennai Trading Academy - CTA,none
404,Currency may be next front in US-China trade war,Some investors fear a currency war between the US and China is coming after Beijing allowed the Yuan to fall below a key symbolic level and President Donald ...,2019-08-08T18:49:12Z,UCe-4xQosMQGkIA8mT4sR98Q,7NCE-ohUSyE,CNN Business,none
405,Pompeo in Senegal: Africa caught in US-China trade war,Mike Pompeo has arrived in Senegal on his first trip to Africa as US secretary of state. He is expected to discuss security and economic cooperation with ...,2020-02-16T07:45:57Z,UCNye-wNBqNL5ZzHSJj3l8Bg,9nfQj-GjkcA,Al Jazeera English,none
406,[The Point : World Affairs] Ep.54 - U.S.-China trade war brings massive damage _ Full Episode,"Prolonged U.S.-China trade war brings massive damage 미중 무역전쟁 장기화, 피해 일파만파 The U.S.-China trade war is still intact since it broke out in June ...",2019-06-16T23:00:02Z,UC-PHIZjV-oX8H7zD1cCN2NQ,ny2Oic-91qw,ARIRANG TV,none
407,US-China trade war: Why the US has the upper hand,Former Commerce Department deputy director Chris Garcia on why the U.S. has the upper hand in its trade war with China.,2018-09-20T15:07:04Z,UCCXoCcu9Rp7NPbTzIvogpZg,WK-XaJ7eMdw,Fox Business,none
408,Chinese government warns global tech companies amid escalating U.S.-China trade war,"中, 무역전쟁 속 삼성 등과 면담…중국 ""정상 활동"" 주장+트럼프 ""시진핑 G20 참석 안 하면 관세 바로 부과"" With the trade war intensifying between Washington and ...",2019-06-11T06:29:33Z,UCzznO4xSV8BKnUBPyswtCUw,xHaubtMwtAM,ARIRANG NEWS,none
409,"US-China trade war: China&#39;s attendance to talks mean they are willing to make deals, says observer","Trade talks between the US and China are set to resume on May 9 in Washington, but looming over these negotiations is the threat of even more tariffs. Dr Henry ...",2019-05-09T14:07:31Z,UC83jt4dlz1Gjl58fzQrrKZg,J7f_CjraKKo,CNA,none
410,Steve Bannon on US-China trade war: I don&#39;t see any short-term let up,"Former Trump advisor Steve Bannon joins ""Squawk Box"" to discuss the ongoing U.S.-China trade talks ahead of the G-20 summit in Osaka, Japan.",2019-06-27T13:22:01Z,UCrp_UI8XtuYfpiqluWLD7Lw,xKfWoQkjd4E,CNBC Television,none
411,Lobster industry feeling impact of U.S.-China trade war,"The U.S. exported more than $142 million worth of lobster to China last year, up from about $108 million in 2016. But that number is expected to take a big hit ...",2018-08-08T12:14:14Z,UC-SJ6nODDmufqBzPBwCvYvQ,vYkbbhrNKYU,CBS This Morning,none
412,These companies are getting crushed on US-China trade war fears,"Stocks bounce back after yesterday's selloff. Looking for trade war bargain buys. With CNBC's Melissa Lee and the Fast Money traders, Pete Najarian, Tim ...",2019-05-08T21:51:20Z,UCrp_UI8XtuYfpiqluWLD7Lw,Iuqs6Gr-CQs,CNBC Television,none
413,Trump May Be Creating World-Wide Recession With Trade War: Jeffrey Sachs,Oct.01 -- Columbia University Professor Jeffrey Sachs examines China's economic slowdown and the impact of the U.S.-China trade war on the global economy.,2019-10-01T18:18:24Z,UCV61VqLMr2eIhH4f51PV0gA,bIoIDhr3rBU,Bloomberg Politics,none
414,Robert Moran on the US-China trade war and the impact on the global economy,"CGTN's Rachelle Akuffo spoke to Robert Moran, a partner for the Brunswick group about the U.S.-China trade war and how its affecting the global economy.",2018-08-07T00:27:09Z,UCj7wKsOBhRD9Jy4yahkMRMw,XjgFyQ4CDRk,CGTN America,none
415,"WORLD THIS WEEK US-China trade war, Istanbul election re-run, All-England European cup finals","Our panel of journalists discuss the biggest topics of the week, starting with the US-China trade war escalating. Meanwhile, in Istanbul citizens prepare ...",2019-05-10T19:06:41Z,UCQfwfsi5VrQ8yKZ-UWmAEFg,zDwcvHaDlo4,FRANCE 24 English,none
416,India Takes Upper Hand In US-China Trade War| Biz Tak,"As America and China Tussle In Trade War and Don't Wish To Go Lenient On Each Other, India Gets An Upper Hand As China And America Both Are Leaned ...",2019-04-17T09:49:45Z,UCSWSOS6YXUbNMzTH-tV7Pfw,ZpstGPZ8Urw,Biz Tak,none
417,Chris Garcia latest update on US - China Trade War ABC7 WJLA,"US - China trade war, explained. Why tariffs? What's the White House's end goal? Chris Garcia, former deputy director of the U.S. Commerce Department speaks ...",2019-07-22T16:43:49Z,UChnCRtOJ95yKfyCNQepDBlw,hSEWLsqy0lI,Chris Garcia,none
418,Investor Jim Rogers discusses a U.S./China trade war impact on the Melt Up,Investor Jim Rogers discusses the implications a trade war between the U.S. and China could have on the Melt Up. ———————————— Download the ...,2018-10-29T16:03:17Z,UCVgL_VeHteGecp5nn0NRztQ,WEc43V3ceJ0,Stansberry Research,none
419,Ray Dalio on US China Trade War,Ray Dalio on US China Trade War.,2019-08-18T03:55:46Z,UCk_TxHij2HH8GtCgP68iVww,o8bYJ8RojI0,Small Business Star -SBS,none
420,Trump&#39;s Trade War is Trashing the U.S. Economy,"President Trump, who has 15 months to keep the economy from collapsing before the next election, is choosing to blame the media for the stock market's woes.",2019-08-16T03:50:00Z,UCMtFAi84ehTSYSE9XoHefig,t_qVnZwsNO8,The Late Show with Stephen Colbert,none
421,"European economy could benefit from US-China trade war, ECB&#39;s Nowotny says | Street Signs Europe","Ewald Nowotny, a Governing Council member of the ECB, discusses the euro zone economy and the impact of the U.S.-China trade war.",2019-06-18T14:00:03Z,UCF8HUTbUwPKh2Q-KpGOCVGw,KVjp6Ax7FCc,CNBC International TV,none
